date,title,url,content
20200107,외환보유액 4천88억달러…석달 연속 최고치 경신,https://n.news.naver.com/mnews/article/001/0011316089,"미 달러, 세계 주요 화폐 (PG)[장현경 제작] 사진합성(서울=연합뉴스) 이지헌 기자 = 우리나라 외환보유액이 석 달 연속 사상 최고치를 경신했다.6일 한국은행에 따르면 지난해 12월 말 외환보유액은 한 달 전보다 13억6천억달러 늘어난 4천88억2천만달러로 집계됐다.지난해 9월 이후 석 달 연속 사상 최고치 기록을 경신한 것이다.외환보유액 증가는 미 달러화가 약세를 띠면서 유로화, 엔화 등 기타통화로 표시된 외화자산의 달러화 환산가치가 늘어난데 따른 것이라고 한은은 설명했다.한은에 따르면 주요 6개국 통화로 달러화 가치를 평가한 달러화 지수는 지난달 말 96.74로 한 달 전보다 1.7% 하락(달러가치 감소)했다.외환보유액 추이※자료: 한국은행작년 12월 말 기준 자산구성 변화를 보면 유가증권(3천850억2천만달러·전체의 94.2%)이 한 달 전보다 85억1천만달러 늘어난 반면 은행에 두는 예치금(128억5천만달러·3.1%)은 73억1천만달러 줄었다.국제통화기금(IMF) 특별인출권(SDR)(33억5천만달러)이 2천만달러 줄어들고,IMF포지션(27억9천만달러)은 1억7천만달러 증가했다. 금(47억9천만달러)은 이전과 같았다.한국의 외환보유액 순위는 지난해 11월 말(4천75억달러) 기준으로 6위 대만(4천741억달러), 7위 인도(4천513억달러), 8위 홍콩(4천342억달러)에 이어 세계 9위를 유지했다.1위는 중국(3조956억달러), 2위는 일본(1조3천173억달러), 3위는 스위스(8천366억달러)로 순위에 변동이 없었다.주요국의 외환보유액 (2019년 11월말 기준)※자료: 한국은행pan@yna.co.kr▶확 달라진 연합뉴스 웹을 만나보세요▶네이버 [연합뉴스] 채널 구독▶뭐 하고 놀까? #흥"
20200107,"스웨덴 '현금없는 사회'에서 궤도 수정…""ATM 줄자 폐해""",https://n.news.naver.com/mnews/article/001/0011316082,"한국은행 보고서모바일간편결제[게티이미지뱅크](서울=연합뉴스) 정수연 기자 = '현금 없는 사회'로 진입한 국가에서 관련 부작용이 나타나고 있으며, 한국도 국민의 현금 접근성이 떨어지지 않도록 대비해야 한다는 지적이 나왔다.한국은행은 6일 '최근 현금 없는 사회 진전 국가들의 주요 이슈와 시사점' 보고서에서 ""한국도 현금 없는 사회로 나아가면서 취약계층의 금융소외·소비활동 제약 문제가 나타나지 않도록 대응책을 미리 마련해야 한다""고 밝혔다.한은은 2000년대 이후 현금 없는 사회로 빠르게 진입한 스웨덴, 영국, 뉴질랜드에서 고령층, 벽지 거주민, 장애인을 중심으로 관련 폐해가 발생했다고 봤다.우선 은행 자동입출금기(ATM)가 줄며 꼭 필요할 때 현금을 인출하기 힘들어졌다. 벽지에 사는 이들은ATM을 찾기 위해 더 먼 거리를 이동해야 하는 문제도 발생했다. 2018년 스웨덴의ATM수는 2014년 대비 21.2% 줄어들었고, 영국은 11.4%, 뉴질랜드는 7.3% 감소한 것으로 나타났다.인구 10만명당ATM개수[한국은행 제공]특히 스웨덴에서는 상인들이 현금결제를 거부하는 일도 늘고 있다. 스웨덴 중앙은행이 설문조사를 한 결과 현금결제를 거부당한 경험이 있는 응답자 비중이 2014년 27%에서 2018년 45%로 크게 뛰었다.한은은 ""이들 국가에서 고령층과 장애인이 현금 사용에 상당한 불편을 겪고 있다는 점이 사회문제로 떠오르고 있다""고 지적했다.이밖에 대규모 정전이 발생하면 지급수단이 사라진다는 점, 디플레이션 시기 안전자산인 현금에 투자하기 어려워지는 점, 소수의 민간 지급결제업체가 시스템을 독과점하게 되는 문제도 발생할 수 있다.다만 한국은 2014년에서 2018년으로 넘어오며ATM이 2.1% 줄어드는 데 그쳤고, 국민 10만명당ATM수 자체도 많아 당장 현금 이용에 불편이 발생하는 상황은 아니다.한은은 ""현금 없는 사회를 수용하던 스웨덴 중앙은행도 최근 어떤 경우에도 국민의 현금 접근성은 보장돼야 한다는 방향으로 입장을 바꿨다""며 ""한국도 현금 없는 사회로의 진행 과정에서 문제가 나타나지 않도록 노력을 기울여야 한다""고 밝혔다.이어 ""국민의 현금 접근성, 현금사용 선택권을 유지하는 데 노력을 기울이겠다""고 덧붙였다.jsy@yna.co.kr▶확 달라진 연합뉴스 웹을 만나보세요▶네이버 [연합뉴스] 채널 구독▶뭐 하고 놀까? #흥"
20200107,"부산 지역화폐 '동백전', 아이폰 앱 서비스 시작",https://n.news.naver.com/mnews/article/001/0011314528,"부산 지역화폐 동백전[부산시 제공](부산=연합뉴스) 오수희 기자 = 부산 지역화폐인 '동백전'을 아이폰에서도 발급받을 수 있게 됐다.부산시는 전날 오후부터 아이폰 앱스토어에서 동백전 애플리케이션 서비스를 시작했다고 4일 밝혔다.안드로이드폰 사용자를 위한 동백전 앱은 지난달 30일 출시됐지만, 아이폰 사용자를 위한 앱은 심사에 시일이 더 걸려 3일 오후에서야 등록됐다.동백전 카드는 모바일 동백전 앱에서 회원가입 후 발급 신청이 가능하다.카드 신청 후 우편으로 받는 데 2~3일 정도 걸린다.카드를 발급받으면 신용카드 단말기가 있는 부산 시내 모든 점포에서 결제한 뒤 사용금액의 6%를 돌려받는다.시는 체크카드지만 부산에서만 쓸 수 있도록 제한했고 백화점이나 대형마트, 기업형 슈퍼마켓, 사행성 업소, 일부 프랜차이즈 직영점 등지에서는 쓸 수 없도록 보완했다.모바일에 익숙하지 않은 사용자들은 가까운KEB하나은행에서 동백전 카드를 발급받을 수 있다.시는 이달 중순까지 부산은행이나 하나은행 창구에서 모바일 앱이 없이도 신분증과 현금만 가지고 동백전을 충전하도록 할 예정이다.3월에는 부산은행에서 직접 동백전 체크카드를 발급할 수 있도록 할 계획이다.시는 동백전 출시 기념으로 이달 31일까지 사용 즉시 10% 캐시백 프로모션을 진행한다.기타 자세한 사항은 동백전 고객센터(☎1577-1432)에 문의하면 된다.osh9981@yna.co.kr▶확 달라진 연합뉴스 웹을 만나보세요▶네이버 [연합뉴스] 채널 구독▶뭐 하고 놀까? #흥"
20200107,중동 리스크에 금융시장 긴장…금·엔화·원유 값 들썩,https://n.news.naver.com/mnews/article/001/0011314484,"(서울=연합뉴스) 신유리 기자 = 미국의 이란 공습으로 중동 리스크가 고조되면서 국제유가가 출렁거리고 있다.4일 블룸버그 통신에 따르면 인도 투자사 코탁의 원자재 리서치 대표인 라빈드라 라오는 미군의 이란 공습 직후인 3일 오후 "" 유가가 더 오를 수 있다""면서 서부텍사스산원유(WTI) 고점을 배럴당 65.5달러로 제시했다.WTI는 공습 직후인 이날 한때 장중 4.4%까지 올라 64달러 선을 위협했다.라오는 일단 64달러를 저항선으로 보고 있지만 만일 이 선을 넘어선다면 65.5달러까지 오를 것으로 예상했다.안전자산으로 분류되는 엔화 가치의 상승도 점쳐지고 있다.투자은행 크레디아그리콜CIB의 데이비드 포레스터는 엔화 가치가 1분기 말 달러당 106엔까지 오를 수 있다고 예상했다.엔화 환율은 3일 현재 달러당 107.93엔으로 거래를 마쳤다.그는 ""미국의 공습에 대한 이란의 대응 가능성을 시장이 리스크로 반영하면서 금, 유가, 엔화 값이 오르는 중""이라고 말했다.역시 안전자산인 금은 3일 장중 현물 가격이 최고 1.48% 올라 온스당 1천545달러를 기록했다.증시에서는 불안감이 확산되면서 위험자산인 주식의 가격 하락을 초래할 수 있다.투자은행UOB-카이히언의 스티븐 렁은 ""투자자들이 이란 내 상황 악화를 우려하고 있다""면서 ""증시는 지난 달 강세장을 보인 만큼 악재가 오면 이익 실현의 계기가 될 것""이라고 말했다.[연합뉴스 자료사진]newglass@yna.co.kr▶확 달라진 연합뉴스 웹을 만나보세요▶네이버 [연합뉴스] 채널 구독▶뭐 하고 놀까? #흥"
20200107,중동 긴장 고조로 금융시장 불안…주가·환율·금리 '출렁'(종합),https://n.news.naver.com/mnews/article/001/0011313974,"미군 공습으로 이란군부 실세 사망…유가 급등 등 긴장 고조코스피 상승분 반납하고 원/달러 환율 9원 올라'중동발 불안' 장중 2,170대 등락(서울=연합뉴스) 김주성 기자 = 미국이 이란 표적 공습으로 중동발 불안이 확대되면서 3일 코스피가 2,170대에서 등락을 거듭했다. 코스피가 전 거래일보다 1.29포인트(0.06%) 오른 2,176.46으로 장을 마감한 이날 오후 서울 을지로KEB하나은행 본점 딜링룸에서 직원들이 업무를 보고 있다. 2020.1.3utzza@yna.co.kr(서울=연합뉴스) 김아람 기자 = 미국과 이란의 갈등이 고조되면서 3일 코스피가 1%대의 상승분을 반납하고 원/달러 환율이 오르는 등 국내 금융시장이 출렁거렸다.이날 코스피는 전 거래일보다 1.29포인트(0.06%) 오른 2,176.46으로 거래를 마쳤다.지수는 전장보다 17.41포인트(0.80%) 오른 2,192.58로 출발해 장 초반 1% 안팎 상승세를 이어갔다. 그러나 오전 중 이란 군부 실세를 겨냥한 미국의 공습 소식이 전해진 후 상승 폭을 대부분 반납하고 장 막판까지 보합권에서 등락을 거듭했다.앞서 이란 군부 실세인 거셈 솔레이마니 쿠드스군(이란혁명수비대 정예군) 사령관이 2일(현지시간) 이라크 바그다드에서 미군 공습에 사망했다.미국 국방부가 도널드 트럼프 미국 대통령의 지시에 따라 미군이 솔레이마니 사령관을 살해했다고 발표하고, 이란 최고지도자 아야톨라 알리 하메네이는 미군 공습에 강력히 보복하겠다고 밝히자 미국과 이란의 무력 충돌 우려가 불거졌다.유가증권시장에서는 외국인이 2천648억원, 개인이 2천715억원을 각각 순매수했다. 반면 기관은 5천452억원어치를 순매도했다.코스닥지수는 전 거래일보다 4.09포인트(0.61%) 내린 669.93에 마감했다.지수는 3.55포인트(0.53%) 오른 677.57로 개장해 강세 흐름을 보이다가 마찬가지로 미국의 공습 소식에 약세로 돌아섰다.2일(현지시간) 이라크 바그다드의 미국 대사관 앞을 경비하는 이라크 대테러부대[AFP=연합뉴스]반면 안전자산인 달러화와 엔화 가치는 강세 흐름을 보였다.이날 서울 외환시장에서 원/달러 환율은 전일 종가보다 9.0원 오른 달러당 1,167.1원에 거래를 마쳤다.환율은 0.4원 오른 1,158.5원에 개장해 장 초반 보합권에서 등락하다 미국의 솔레이마니 사령관 공습 소식이 신흥국 통화 약세를 촉발하자 오전 11시께 상승 흐름을 탔다.이날 오후 4시 30분 기준 엔/달러 환율은 전장 뉴욕 대비 0.525엔 하락한 108.030엔을 나타냈다.금융시장의 불안감이 커지자 국고채 금리도 일제히 큰 폭으로 하락(채권값 상승)했다.이날 서울 채권시장에서 3년 만기 국고채 금리는 전 거래일보다 5.7bp(1bp=0.01%포인트) 내린 연 1.270%에 마감했다.10년물은 연 1.555%로 8.3bp 하락했다. 5년물과 1년물도 각각 연 1.361%, 연 1.299%로 8.0bp, 2.0bp 내렸다.20년물은 연 1.601%로 6.0bp 내렸다. 30년물은 연 1.586%로 6.6bp 내리고 50년물은 연 1.588%로 6.4bp 하락 마감했다.한편 국제유가는 중동 지정학 위험 고조에 급등하고 있다. 이날 오후 4시 30분 현재 2월물 서부 텍사스산 원유(WTI) 가격은 배럴당 1.76 달러(2.88%) 오른 62.94달러를 기록했다.안영진SK증권 연구원은 ""미국이 공습해 이란 혁명수비대 총사령관이 사망했다는 소식은 우리나라뿐 아니라 국제 금융시장의 위험 요인으로 부각됐다""며 ""아시아권 증시가 일제히 급격히 조정받고 엔화 가치가 상승한 것은 시장 내 위험 회피 및 안전 선호가 나타났음을 의미한다""고 설명했다.rice@yna.co.kr▶확 달라진 연합뉴스 웹을 만나보세요▶네이버 [연합뉴스] 채널 구독▶뭐 하고 놀까? #흥"
20200107,이란군 일인자 美공습 사망에 원/달러 환율 9원 급등,https://n.news.naver.com/mnews/article/001/0011313720,"(서울=연합뉴스) 정수연 기자 = 3일 원/달러 환율이 9원 뛰었다.이란 군부 실세인 거셈 솔레이마니 쿠드스군(이란혁명수비대 정예군) 사령관이 이라크 바그다드에서 미군 공습에 사망했다는 소식에 중동 정세에 대한 우려가 커진 영향이다.이날 서울 외환시장에서 원/달러 환율은 전일 종가보다 9.0원 오른 달러당 1,167.1원에 거래를 마쳤다.환율은 0.4원 오른 1,158.5원에 개장해 장 초반 보합권에서 등락하다 오전 11시께 상승 흐름을 탔다.미국의 솔레이마니 사령관 공습 소식이 원화를 비롯한 신흥국 통화 약세를 촉발했다.이란 최고지도자 아야톨라 알리 하메네이는 솔레이마니 사령관 사망 이후 긴급 성명을 통해 미군의 공습에 대해 강력히 보복하겠다고 밝혔다.금융·외환시장에서는 이란이 실제로 미국에 보복을 가할 경우 중동 정세가 더 격화할 수 있다는 우려가 확산하는 모습이다.민경원 우리은행 연구원은 ""최근 원/달러 환율이 '바닥을 다지고 있다'는 평가가 나온 가운데 중동 발(發) 위험회피 재료에 환율이 상승했다""고 말했다.원/엔 재정환율은 오후 3시 30분 기준 100엔당 1,079.60원이다. 전 거래일 오후 3시 30분 기준가(1,065.07원)에서 14.53원 급등했다.이란 지도자 아야톨라 세예드 알리 하메네이(왼쪽)와 쿠드스 사령관(오른쪽)[EPA=연합뉴스 자료사진]jsy@yna.co.kr▶확 달라진 연합뉴스 웹을 만나보세요▶네이버 [연합뉴스] 채널 구독▶뭐 하고 놀까? #흥"
20200108,이란 보복공격에 원/달러 환율 '출렁'…4.4원 상승 마감,https://n.news.naver.com/mnews/article/001/0011323146,"이란 보복 공격에 '코스피 떨어지고 환율 오르고'(서울=연합뉴스) 김도훈 기자 = 이란 혁명수비대가 이라크 내 미군기지에 대한 보복 공격을 감행한 8일 코스피는 1% 이상 하락 마감했다.이날 코스피는 전 거래일보다 24.23포인트(1.11%) 내린 2,151.31로 장을 마쳤고, 원/달러 환율은 4.4원 오른 1천170.8원으로 거래를 마쳤다.8일 서울 중구KEB하나은행 딜링룸에 코스피 종가와 환율이 스크린에 나타나 있다. 2020.1.8superdoo82@yna.co.kr(서울=연합뉴스) 김연숙 기자 = 미국과 이란 간 군사적 긴장이 높아진 8일 원/달러 환율 시장이 출렁거렸다.이날 서울 외환시장에서 원/달러 환율은 전일 종가보다 4.4원 오른 달러당 1,170.8원에 거래를 마쳤다.환율은 3.9원 오른 1,170.3원에 거래를 시작해 오전 한때 1,179.3원까지 치솟기도 했다가 점차 상승폭을 줄였다.이란이 이라크 내 미군기지 2곳에 대해 미사일 공격을 했다는 소식이 중동 리스크를 고조시키면서 글로벌 금융시장에 안전자산 선호 분위기를 급속히 키웠다.다만 도널드 트럼프 미 대통령의 트윗과 필요시 시장안정 조치에 나서겠다는 한국은행의 대응, 수출업체의 네고(달러화 매도) 물량 등이 영향을 미치면서 환율이 점차 숨고르기에 들어갔다.트럼프 대통령은 트위터를 통해 이란의 공격과 관련, ""우리는 전 세계 어느 곳보다 단연코 가장 잘 갖춰진 군을 보유하고 있다""고 밝히면서도 직접적인 보복 공격을 언급하지는 않았다.정부와 한국은행은 긴급회의를 열고 점검반을 가동해 금융시장과 외환시장 동향을 매일 점검키로 했다고 밝혔다.특히 한은은 통화금융대책반 회의를 연 뒤 보도자료를 통해 이번 사태로 금융·외환시장 변동성이 확대할 가능성이 있다며 ""필요시 시장 안정화 조치를 취하겠다""고 밝혔다.원/엔 재정환율은 오후 3시 30분 현재 100엔당 1,080.62원이다. 전일 오후 3시 30분 기준가(1,076.16원)에서 4.46원 올랐다.nomad@yna.co.kr▶확 달라진 연합뉴스 웹을 만나보세요▶네이버 [연합뉴스] 채널 구독▶뭐 하고 놀까? #흥"
20200108,"日증시, 이라크 미군기지 피격 영향 '출렁'…닛케이지수 1.57%↓(종합)",https://n.news.naver.com/mnews/article/001/0011322924,"(도쿄=연합뉴스) 박세진 특파원 = 일본 증시가 8일 이라크 주둔 미군 기지에 대한 이란의 미사일 보복 공격에 따른 충격파로 크게 출렁거렸다.도쿄 증시 대표 지수인 닛케이225 평균주가는 이날 전날 종가보다 370.96포인트(1.57%) 떨어진 23,204.76으로 거래가 끝났다.닛케이225는 이날 개장 직전 전해진 이란의 미사일 공격 소식으로 오전장에서 한때 낙폭이 624.54포인트(2.65%)로 커지면서 23,000선이 붕괴했다.닛케이225가 장중 23,000선 밑으로 떨어진 것은 작년 11월 21일 이후 약 1개월 반 만이었다.그러나 오후장 들어 미국의 대응을 관망하는 투자자들의 저가 매수세가 유입되면서 일부 낙폭이 만회됐다.도쿄 증시 1부 전 종목 주가를 반영하는 토픽스(TOPIX) 지수는 전날 종가 대비 23.65포인트(1.37%) 내린 1,701.40으로 마감됐다.토픽스 지수도 이날 장 초반에 41.29포인트(2.39%)나 빠지면서 1,683선까지 밀렸다가 오후장 들어 낙폭이 줄어드는 모습을 보였다.한편 도쿄 외환시장에서 달러 대비 엔화 환율은 이날 오전 9시 32분 기준 달러당 107.65엔까지 떨어졌다(엔화가치 상승)가 오후 3시 8분 현재 108.28~108.29엔을 회복했다.도쿄 증권거래소 [연합뉴스 자료사진]parksj@yna.co.kr▶확 달라진 연합뉴스 웹을 만나보세요▶네이버 [연합뉴스] 채널 구독▶뭐 하고 놀까? #흥"
20200108,군산사랑상품권 할인율 8%로 하향조정…구매 한도는 70만원,https://n.news.naver.com/mnews/article/001/0011322666,"군산사랑상품권[연합뉴스 자료사진](군산=연합뉴스) 백도인 기자 = 전북 군산시가 지역화폐인 군산사랑상품권의 할인율을 올해부터 8%로 하향 조정하고 8일부터 판매를 재개했다.군산사랑상품권의 할인율은 2018년 9월 도입 이후부터 10%를 유지해왔으나 이번에 2% 포인트 낮아진 것이다.연간 발행 규모도 작년의 4천억원에서 3천억원으로 축소한다.개인별 구매 한도는 기존과 같은 월 70만원이다.군산시는 행정안전부가 상품권의 할인율을 가급적 8% 이내로 유지하도록 한 데 따른 조처라고 설명했다.과도한 할인율로 재정 부담이 가중되는 것도 한 이유다.지난해 10%의 할인율을 적용하며 소요된 군산시 자체 예산은 240억원에 달한다.앞서 군산시는 상품권의 사용액에 따라 최대 2만원까지를 돌려주던 '골목상권 소비지원 사업'도 올해부터는 폐지하기로 했다.군산시 관계자는 ""행안부의 지침과 예산 상황 등을 두루 고려해 불가피하게 내린 결정이며, 할인율 인하로 확보되는 예산은 지역경제 활성화를 위한 사업에 사용될 것""이라고 말했다.doin100@yna.co.kr▶확 달라진 연합뉴스 웹을 만나보세요▶네이버 [연합뉴스] 채널 구독▶뭐 하고 놀까? #흥"
20200108,"亞증시, 이란 美기지 공격에 동반 추락…유가는 5% 급등",https://n.news.naver.com/mnews/article/001/0011321815,"日증시 2%대 하락…브렌트유 70달러 돌파(서울=연합뉴스) 신유리 기자 = 아시아 주요국 증시가 8일 이란의 이라크 내 미군 기지 공격 소식에 일제히 추락하고 국제 유가는 급등했다.이날 오전 10시 38분 현재(이하 한국 시간) 일본 증시의 토픽스 지수와 닛케이 225 지수는 각각 전장보다 2.33%, 2.56% 떨어졌다.중국의 상하이종합지수와 선전종합지수는 각각 0.63%, 0.57% 내렸다.홍콩 항셍지수와 대만 자취안 지수도 각각 1.60%, 0.80% 하락했다.한국의 코스피는 1.65% 내렸고 특히 코스닥 지수는 3.90%나 급락했다.이란의 보복 공격에 따라 중동 지역의 긴장이 더 높아지면서 국제 유가는 5%대의 급등세를 보였다.런던ICE선물거래소에서 3월물 브렌트유는 이날 오전 10시께 배럴당 5.1% 오른 71.75달러에 거래됐고, 뉴욕상업거래소(NYMEX)의 2월물 서부 텍사스산 원유(WTI)도 이날 오전 9시 22분께 4.7% 뛴 65.65달러까지 치솟았다.또 대표적인 안전자산인 금 현물 가격은 같은 시간 온스당 1,603달러로 전장보다 2.38%(37.33달러) 상승했다. 국제 금값이 온스당 1천600달러를 넘어선 것은 2013년 4월 이후 약 6년 9개월만의 처음이다.역시 안전자산으로 통하는 엔화도 이날 오전 9시 30분께 달러당 107.65엔까지 내리면서 3개월 만의 최고 가격을 기록했다.이란은 이날 미군이 주둔한 이라크 아인 알아사드 공군기지 등에 지대지 탄도미사일 수십발을 발사했다고 밝혔다.이는 지난 3일 미국의 드론 공습으로 가셈 솔레이마니 이란 쿠드스군(이란혁명수비대 정예군) 사령관이 숨진 데 대한 보복 공격이다.캐나다 투자은행TD시큐리티즈의 관계자는 ""시장은 긴장 상태를 유지할 것""이라며 ""이제는 미국의 반응 및 확전 여부에 많은 것이 달려있다""고 말했다.이라크 미군기지 겨냥한 이란 미사일 발사 장면(아인 아사드 공군기지AFP=연합뉴스) 8일(현지시간) 이란에서 미군 주둔 이라크 아인 아사드 공군기지를 겨냥해 미사일이 발사되고 있다고 보도하는 이란 국영IRIB방송의 화면.jsmoon@yna.co.krnewglass@yna.co.kr▶확 달라진 연합뉴스 웹을 만나보세요▶네이버 [연합뉴스] 채널 구독▶뭐 하고 놀까? #흥"
20200108,"한은, 오후 2시 통화금융대책반 회의…이란 공격 여파 점검",https://n.news.naver.com/mnews/article/001/0011321657,"[연합뉴스TV제공](서울=연합뉴스) 이지헌 기자 = 한국은행은 8일 오후 2시 본관 대회의실에서 윤면식 부총재 주재로 통화금융대책반 회의를 열어 미국과 이란 간 군사적 긴장 고조에 따른 금융·외환시장 영향을 점검한다고 밝혔다.이날 오전 이란이 이라크 내 미군기지를 공습했다는 소식이 전해지자 서울 외환시장 원/달러 환율은 전일 종가보다 10원 이상 오른 1,170원대를 나타냈다.코스피도 전 거래일보다 1% 이상 내리며 장중 2,150선이 무너지기도 했다.앞서 이란이 이날 오전 미군이 주둔한 이라크 아인 아사드 공군기지에 지대지 미사일 수십발을 발사했다고AP통신이 이란 국영TV를 인용해 보도했다.이란 국영TV는 이번 공격이 가셈 솔레이마니 이란 쿠드스군(이란혁명수비대 정예군) 사령관을 숨지게 한 미국을 향한 보복 작전이라고 밝혔다.pan@yna.co.kr▶확 달라진 연합뉴스 웹을 만나보세요▶네이버 [연합뉴스] 채널 구독▶뭐 하고 놀까? #흥"
20200108,"日증시, 이라크 주둔 미군 기지 피격 소식에 급락세",https://n.news.naver.com/mnews/article/001/0011321283,"(도쿄=연합뉴스) 박세진 특파원 = 일본 증시가 8일 이라크 주둔 미군 기지에 대한 이란의 미사일 공격 소식에 영향을 받아 급락 장세를 연출하고 있다.도쿄 증시 대표 지수인 닛케이225 평균주가는 이날 오전 9시 18분 현재 전날 종가보다 513.15포인트(2.18%) 빠진 23,062.57을 기록하고 있다.또 도쿄 증시 1부 전 종목 주가를 반영하는 토픽스(TOPIX) 지수는 오전 9시 22분 기준으로 32.53포인트(1.89%) 급락한 1,692.52로 1,700선이 무너졌다.도쿄 외환시장에서 달러 대비 엔화 환율은 오전 9시 15분 현재 달러당 107.82~107.83엔으로, 전날 오후 5시 시점보다 0.50엔(0.46%) 하락하는 등 엔화 강세장이 이어지고 있다.이란 국영 방송은 이날 도쿄 증시 개장 직전에 이라크의 미군기지에 다수의 지대지 미사일을 발사했다고 보도했다.닛케이225 평균주가 3개월 추이 그래프 [시황 페이지 캡처]parksj@yna.co.kr▶확 달라진 연합뉴스 웹을 만나보세요▶네이버 [연합뉴스] 채널 구독▶뭐 하고 놀까? #흥"
