date,title,url,content
20200114,전날 급락후 소폭 반등…원/달러 환율 2.2원 상승,https://n.news.naver.com/mnews/article/001/0011328086,"9일 오후 서울 중구 을지로KEB하나은행 딜링룸에서 외환 딜러가 오가고 있다. [연합뉴스 자료사진](서울=연합뉴스) 김연숙 기자 = 전날 10원 넘게 떨어진 원/달러 환율이 10일 조금 오른 채 마감했다.이날 서울 외환시장에서 원/달러 환율은 전일 종가보다 2.2원 오른 달러당 1,161.3원에 거래를 마쳤다.환율은 0.1원 오른 1,159.2원에 거래를 시작해 장중 1,164.0원까지 고점을 높이긴 했지만 대체로 1,161원 안팎에서 움직였다.전날 환율은 미국과 이란 간 충돌 우려가 완화하면서 살아난 위험 자산 선호 분위기에 힘입어 11.7원 급락했다.국내 증시도 이틀 연속 상승 마감했다.코스피는 전 거래일보다 19.94포인트(0.91%) 오른 2,206.39로 종료했다. 종가 기준으로 작년 5월 2일 이후 8개월여만에 가장 높은 수준이다. 외국인이 3천805억원어치를 순매수하며 지수 상승을 이끌었다.다만 장중 한때 역외 위안화 환율이 상승하면서 원/달러 환율도 올랐다가 다시 위안화와 연동해 상승폭을 줄였다.원/엔 재정환율은 오후 3시 30분 기준 1,059.82원이다. 전날 오후 3시 30분 기준가(1,060.72원)에서 0.9원 내렸다.nomad@yna.co.kr▶확 달라진 연합뉴스 웹을 만나보세요▶네이버 [연합뉴스] 채널 구독▶뭐 하고 놀까? #흥"
20200114,"중국 기업, 경기 둔화에 해외 디폴트 확대…지난해 36억 달러",https://n.news.naver.com/mnews/article/001/0011327245,"국유기업에서 항공·태양광 등 전업종 확산상하이 푸둥 상하이 타워[촬영 차대운](서울=연합뉴스) 김대호 기자 = 중국이 작년 경기 둔화 속에 해외 디폴트(채무불이행)도 확대된 것으로 나타났다.블룸버그통신은 자체 집계 결과 중국이 작년 해외에서 발행한 달러화 채권의 디폴트 금액이 36억달러로 전년의 33억달러보다 증가했다고 10일 보도했다.블룸버그는 최소 7개 업체가 채무상환을 제때 이행하지 못했다고 밝혔다.중국 기업들은 자국 내 자금 조달이 어려워진 해외에서 달러화 채권 발행을 늘렸는데, 그 규모가 8천150억달러 이상으로 추산되고 있다.기업들은 특히 정부 감시를 피해 사실상 자금 조달 창구로 이용돼온 금융상품 등 그림자 금융에 대한 단속이 강화된 후 해외 자금 조달을 늘린 것으로 보인다.중국 기업들의 해외 디폴트는 또 위안화로 발행된 국내 채권을 상환하지 못한 후 그 여파가 해외로 확산한 것이어서, 최근 중국 내 디폴트 우려는 해외 투자자들의 불안감을 높이고 있다.2018년 포천 500대 기업 순위에서 132위에 올랐던 톈진물산(天津物産·Tewoo)은 작년 국유기업으로는 20년 만에 처음으로 달러화 채권 12억5천만달러(1조3천억원)의 디폴트를 기록했으며, 채무 조정을 통해 57%의 채권자들은 달러당 37센트만 상환받았다.한 때 중국판JP모건을 표방했던 민성(民生)투자는 작년 1월 과도한 부채를 견디지 못하고 위안화 채권의 디폴트를 내더니 수개월 후 2개의 달러화 표시 채권 디폴트를 기록했다.올해 24억달러의 채권 만기가 돌아오는 민성투자는 자금 확보를 위해 경영진 임금을 삭감하고 자산을 매각하고 있다.화천에너지(華晨能源)는 작년 12월 5억달러를 갚지 못해 채무 불이행자 명단에 이름을 올렸다.화천에너지의 어려움은 모기업인 윈타임에너지가 2018년 대규모 디폴트를 기록한 후 어느 정도 예견됐다.석탄 채굴사업자인 윈타임에너지는 저금리로 돈을 빌려 인수합병을 추진, 금융, 물류 등으로 사업을 확장했으나 2016년 정부 차원에서 금융위험 관리가 강화되고 금리가 크게 오르며 채무 상환에 곤란을 겪었다.캉더신(康德新)복합재료그룹은 2018년까지 재정이 튼튼한 것으로 알려졌으나 금융당국 조사 결과 허위로 드러났으며, 작년 초 국내 채권 디폴트에 이어 3억달러의 해외 디폴트를 발생시켰다.태양광 업체인 중국신에너지태양광기술(中國新能源太陽能科技)은 자국 내 국유 기업들과 경쟁에서 버티지 못하고 작년 2개의 달러화 채권에서 2억6천만 달러의 디폴트를 나타냈다.또 공항운영자인 하이커우메이란(海口美蘭)국제공항도 작년 9월 2억달러를 갚지 못했으며, 코카콜라의 인수 대상으로 꼽히기도 했던 중국후이위안주스(匯源果汁)는 주신리 회장의 개인 회사에 돈을 빌려줬다가 홍콩달러로 발행한 전환사채의 상환에 실패했다.daeho@yna.co.kr▶확 달라진 연합뉴스 웹을 만나보세요▶네이버 [연합뉴스] 채널 구독▶뭐 하고 놀까? #흥"
20200115,민주당 부산시당 지역화폐 동백전 릴레이 홍보,https://n.news.naver.com/mnews/article/001/0011337863,"부산 지역화폐 동백전[부산시 제공](부산=연합뉴스) 조정호 기자 = 더불어민주당 부산시당이 부산 지역화폐 '동백전' 보급 확산에 발 벗고 나섰다.민주당 부산시당은 국회의원, 총선 예비후보, 지방의원 등이 참여하는 '동백전 릴레이 홍보 챌린지' 캠페인을 31일까지 한다고 15일 밝혔다.'동백전 릴레이 홍보 챌린지'는 부산지역 국회의원 6명과 부산시의회 의장이 동백전 카드발급 사진과 사용 인증샷을 페이스북에 올린 뒤 다음 주자 3명을 지정해 이어가는 방식으로 이뤄진다.부산진갑 국회의원인 김영춘 의원은 가입 첫날 32만1천원을 사용했다며 동백전 카드 사진을 페이스북에 올렸다.김 의원은 다음 주자로 서은숙 부산진구청장과 류영진 부산진을 총선 예비후보, 최형욱 동구청장 등 3명을 지명했다.챌린지에 참여하는 민주당 선출직 공직자 등은 본인은 물론 지인과 함께 동백전 카드를 발급받고 전통시장과 소상공인이 운영하는 업체에서 동백전을 사용한다.ccho@yna.co.kr▶확 달라진 연합뉴스 웹을 만나보세요▶네이버 [연합뉴스] 채널 구독▶뭐 하고 놀까? #흥"
20200115,미중 1단계 무역합의 서명 앞두고 원/달러 환율 강보합 마감,https://n.news.naver.com/mnews/article/001/0011337531,"(서울=연합뉴스) 성서호 기자 = 15일 원/달러 환율이 강보합권에서 마감했다.이날 서울 외환시장에서 원/달러 환율은 전날 종가에서 0.9원 오른 달러당 1,157.0원에 거래를 마쳤다.3.9원 오른 1,160.0원에서 시작한 환율은 장중 한때 1,162.7원까지 올랐지만, 점차 상승폭을 좁혔다.미국이 오는 11월 대선까지는 기존의 대(對)중국 관세를 유지하기로 하면서 장 초반 불확실성이 다소 커졌지만, 다가올 미·중 1단계 무역 합의 서명에 대한 기대감이 달러 매수 심리를 둔화시킨 것으로 보인다.AP통신에 따르면 도널드 트럼프 미국 대통령과 중국의 협상 대표 류허(劉鶴) 부총리는 16일 새벽(한국시간) 1단계 무역 합의에 서명할 예정이다.이날 코스피는 전날보다 0.35% 하락한 2,230.98에 장을 마쳤다. 외국인은 약 800억원어치를 팔았다.같은 시각 원/엔 재정환율은 100엔당 1,052.54원으로, 전날 오후 3시 30분 기준가(1,050.09원)에서 2.45원 올랐다.미중 합의(CG)[연합뉴스TV제공]soho@yna.co.kr▶확 달라진 연합뉴스 웹을 만나보세요▶네이버 [연합뉴스] 채널 구독▶뭐 하고 놀까? #흥"
20200115,대전시 7월 지역화폐 2천500억원 발행…자금 지역외 유출 방지,https://n.news.naver.com/mnews/article/001/0011337499,"대전시청 전경[연합뉴스 자료사진](대전=연합뉴스) 김준호 기자 = 대전시는 오는 7월 2천500억원 규모 지역화폐를 발행할 계획이라고 15일 밝혔다.1인당 구매 한도는 월 50만원, 연간 500만원이다. 구매금액의 5%(명절 등 특별판매 기간 10%)를 추가 지급한다.발행일부터 5년간 대전에서만 사용할 수 있다.백화점과 대형마트, 사행·유흥업소 등을 제외한 지역 내 신용카드 단말기가 있는 모든 점포에서 쓸 수 있다.지역화폐 전담 부서인 소상공인과를 신설한 시는 다음 달 중 세부 추진 계획을 수립할 방침이다.오는 3월 지역화폐 명칭을 공모하고 운영 대행사도 공개 경쟁입찰을 통해 선정할 예정이다.대전시 관계자는 ""지역화폐 발행으로 소상공인 1인당 소득이 2.13% 늘고 관광객의 지역 내 소비지출이 3.75배 증가한다고 행정안전부가 2018년 발표했다""며 ""지역 소비를 활성화하고 소상공인과 자영업자, 소비자 모두 혜택을 보는 지역화폐가 되도록 준비하겠다""고 말했다.대덕e로움[대전 대덕구 제공. 재판매 및DB금지]대전에서는 대덕구가 지난해 7월 지역 자금 역외 유출 방지, 소상공인 매출 증대를 위해 지역화폐 '대덕e로움'을 발행했다.대덕구는 올해 대덕e로움을 300억원 발행할 계획이다.대덕구 관계자는 ""대전시 지역화폐와 연계 발행해 상생할 수 있도록 실무협의를 진행할 것""이라며 ""상시 할인율을 높여주는 등 구에서 지역화폐를 썼을 때 혜택을 더 주는 부분에 대해서도 협의할 것""이라고 설명했다.kjunho@yna.co.kr▶확 달라진 연합뉴스 웹을 만나보세요▶네이버 [연합뉴스] 채널 구독▶뭐 하고 놀까? #흥"
20200115,"화성시, 지역화폐 인센티브 10%로 확대",https://n.news.naver.com/mnews/article/001/0011337321,"(화성=연합뉴스) 최해민 기자 = 올해 경기 화성 지역화폐인 '행복화성지역화폐'를 사면 상시 10%의 인센티브를 받게된다.행복화성지역화폐[화성시 제공. 재판매 및DB금지]화성시는 지역화폐 인기에 힘입어 올 한해 인센티브 규모를 상시 6%에서 10%로 늘리기로 했다고 15일 밝혔다.구매 한도는 월 50만원, 연간 600만원으로, 이용자는 연간 60만원까지 혜택을 받게 됐다.올해 들어 이날까지 화성지역화폐는 총 21억6천여만원 어치 발행됐고, 모두 10%(2억1천여만원)의 인센티브가 제공됐다.지난해 처음 발행된 행복화성지역화폐는 당초 목표치였던 120억원을 넘겨 173억원 발행됐다.올해 화성시는 전년 발행액 대비 127억원 증가한 300억원 발행을 목표로 세웠다.지난해 행복화성지역화폐 발급 건수는 화성시 전체 인구의 16%에 해당하는 5만 1천여 건으로 집계됐다.화성시 관계자는 ""명절이나 휴가철 등 특별기간과 관계없이 상시 10% 인센티브를 제공해 구매력을 높일 계획""이라며 ""현재 사용처는 3만5천 곳으로, 인센티브를 받는 이용자는 물론, 신용카드보다 적은 수수료를 내는 소상공인에게도 호응이 좋은 상황""이라고 말했다.goals@yna.co.kr▶확 달라진 연합뉴스 웹을 만나보세요▶네이버 [연합뉴스] 채널 구독▶뭐 하고 놀까? #흥"
20200115,"원/달러 환율 상승 출발…장 초반 1,160원대 재진입",https://n.news.naver.com/mnews/article/001/0011335926,"(서울=연합뉴스) 성서호 기자 = 15일 원/달러 환율이 상승 출발했다.서울 외환시장에서 이날 오전 9시 15분 현재 원/달러 환율은 전날 종가보다 4.7원 오른 달러당 1,160.8원을 기록했다.3.9원 오른 채 출발한 환율은 이후 상승 폭을 키우면서 1,160원 초반대에서 움직이고 있다.미국이 11월 대선까지는 기존의 대(對) 중국 관세를 유지하기로 하면서 미중 무역 합의에 관한 기대감이 둔화했다.불룸버그 통신은 14일(현지시간) 익명의 소식통을 인용해 ""추가적인 관세 인하는 앞으로 최소 10개월간 중국의 1단계 무역 합의 이행 여부를 점검한 이후에 논의될 것""이라고 보도했다.경제매체CNBC방송도 당국자를 인용해 ""대중 관세는 2020년 대선 기간 내내 유지될 것""이라며 ""미·중 합의사항에 추가적인 관세 인하 문제는 없다""고 전했다.민경원 우리은행 연구원은 ""미국의 대중 관세 유지 소식은 과열됐던 무역 합의 낙관론과 위험 선호 심리를 얼어붙게 했다""고 전했다.원/엔 재정환율은 오전 9시 15분 현재 100엔당 1,056.17원으로 전날 오후 3시 30분 기준가(1,050.09원)에서 6.08원 올랐다.원화값(CG)[연합뉴스TV제공]soho@yna.co.kr▶확 달라진 연합뉴스 웹을 만나보세요▶네이버 [연합뉴스] 채널 구독▶뭐 하고 놀까? #흥"
20200115,"[외환] 원/달러 환율 3.9원 오른 1,160.0원(개장)",https://n.news.naver.com/mnews/article/001/0011335833,"원/달러 환율 3.9원 오른 1,160.0원(개장) (PG)[장현경 제작] 사진합성▶확 달라진 연합뉴스 웹을 만나보세요▶네이버 [연합뉴스] 채널 구독▶뭐 하고 놀까? #흥"
20200115,구리 은행서 100달러 위폐 환전…수사 의뢰,https://n.news.naver.com/mnews/article/001/0011335527,"100달러짜리 위조지폐[연합뉴스 자료사진](구리=연합뉴스) 김도윤 기자 = 한 남성이 은행에서 환전하려던 미화 100달러짜리 구권이 위조지폐로 확인돼 경찰이 수사에 나섰다.14일 경기 구리경찰서에 따르면 A씨는 지난 9일 구리시내 한 은행 창구에서 미화 100달러짜리 구권 9장을 내밀며 환전을 요청했다.그러나 지폐 문양이 번져있었다.은행 직원은 위조지폐인 것을 곧바로 알아채 경찰에 신고했고, A씨는 현장에서 붙잡혔다.A씨는 경찰에서 ""브라질에 사는 처남이 100달러짜리 지폐를 줘 환전하려 했다""며 ""위조지폐인 줄 몰랐다""고 진술했다.경찰은 A씨가 이 지폐를 입수한 경위와 위조지폐인 줄 알았는지 등을 조사 중이다.한편 미 연방준비제도는 남미 지역을 중심으로 100달러짜리 위조지폐 범죄가 기승을 부리자 2013년 10월부터 신권을 발행했다.kyoon@yna.co.kr▶확 달라진 연합뉴스 웹을 만나보세요▶네이버 [연합뉴스] 채널 구독▶뭐 하고 놀까? #흥"
20200115,원/달러 환율 강보합 마감…결제·저가 매수세 유입,https://n.news.naver.com/mnews/article/001/0011334932,"(서울=연합뉴스) 성서호 기자 = 14일 원/달러 환율이 소폭 상승한 채 마감했다.이날 서울 외환시장에서 원/달러 환율은 전날 종가에서 0.1원 오른 달러당 1,156.1원에 거래를 마쳤다.2.3원 내린 1,153.7원에서 시작한 환율은 오전 한때 1,150.6원까지 저점을 낮췄으나 이후 서서히 낙폭을 줄였다.장 마감 앞두고는 보합권에서 소폭 등락을 반복하다가 막판에 상승 전환했다.미국이 중국을 환율조작국에서 제외하면서 하락 출발했으나 결제 수요와 저가 매수 등이 겹치면서 하락분을 모두 반납했다.전승지 삼성선물 연구원은 ""중국이 환율조작국에서 제외되면서 위안화 강세 등 영향으로 원/달러가 하락했지만, 이후 위안화가 빠르게 낙폭을 줄이면서 비슷하게 움직였다""며 ""하단에서 결제 수요가 나오면서 장중 낙폭을 줄였다""고 설명했다.같은 시각 원/엔 재정환율은 100엔당 1,050.09원으로, 전날 오후 3시 30분 기준가(1,054.50원)에서 4.41원 내렸다.미국, 중국 환율조작국 해제(PG)[권도윤 제작] 사진합성·일러스트soho@yna.co.kr▶확 달라진 연합뉴스 웹을 만나보세요▶네이버 [연합뉴스] 채널 구독▶뭐 하고 놀까? #흥"
20200115,"[외환] 원/달러 환율 0.1원 오른 1,156.1원(마감)",https://n.news.naver.com/mnews/article/001/0011334811,"원/달러 환율 0.1원 오른 1,156.1원(마감) (PG)[장현경 제작] 사진합성▶확 달라진 연합뉴스 웹을 만나보세요▶네이버 [연합뉴스] 채널 구독▶뭐 하고 놀까? #흥"
20200115,미·중 관계개선 전망에 엔화 값 8개월 만에 최저치,https://n.news.naver.com/mnews/article/001/0011333937,"(도쿄=연합뉴스) 박세진 특파원 = 일본 엔화가 미·중 관계가 개선될 것이라는 낙관적인 전망으로 약세를 보이고 있다.도쿄 외환시장에서 미 달러 대비 엔화 환율은 14일 오전 9시56분 달러당 110.16엔까지 올라 작년 5월 이후 약 8개월 만에 최고치(엔화 가치는 최저치)를 기록했다.이날 오전 11시 20분 현재 달러당 엔화 환율은 달러당 110.04~110.05엔을 기록했다.현재 시장에선 엔고·엔저를 가르는 기준선을 달러당 108엔으로 잡고 있는 점을 고려하면 엔화 약세가 가파르게 진행되고 있음을 알 수 있다.일본 언론은 시장 관계자들을 인용해 미국 재무부가 중국의 환율조작국 지정을 취소했다고 발표하면서 미·중 관계가 개선될 것이라는 기대감이 커져 달러화를 사고 엔화를 파는 움직임이 나타났다고 전했다.미국은 13일(현지시간) 발표한 '환율정책 보고서'에서 중국을 환율조작 대상 국가에서 제외하고 관찰대상국에 넣었다.작년 8월 중국을 환율조작국으로 전격 지정한 지 5개월여만으로, 15일 예정된 중국과의 1단계 무역 합의 서명 이틀 전에 해제가 이뤄졌다.한편 도쿄 증시 대표 지수인 닛케이225는 엔화 약세 영향으로 직전 거래일 종가 대비 176.24포인트(0.74%) 오른 24,026.81에 오전장 거래가 끝났다.달러/엔 환율 지난 1년간 추이 [닛케이 시황 페이지 캡처]parksj@yna.co.kr▶확 달라진 연합뉴스 웹을 만나보세요▶네이버 [연합뉴스] 채널 구독▶뭐 하고 놀까? #흥"
20200115,"곡성 심청상품권, 발행 20주년 혜택 더욱 풍성",https://n.news.naver.com/mnews/article/001/0011333762,"할인률 높이고 모바일 상품권도 발행모바일 곡성심청상품권 출시 이벤트[곡성군 제공. 재판매 및DB금지](곡성=연합뉴스) 박철홍 기자 = 전남 곡성군의 지역 화폐인 심청상품권이 발행 20주년을 맞아 새로운 변화를 꾀한다.곡성 심청상품권은 지역 상권 활성화를 위해 2001년 9월 최초 발행됐다.초기에는 발행량이 증가하다가 2014년 12억원을 기점으로 매년 조금씩 감소해 2017년에는 10억9천만원가량이 판매됐다.곡성군은 감소세를 해결하고자 2018년부터 기차마을 입장권을 3천원에서 5천원으로 인상하고 2천원 인상분을 심청상품권으로 되돌려주는 정책을 펼쳤다.그 결과 판매량이 150%가량 급상승해 연간 27억의 판매고를 올리는 전환점이 됐다.곡성군은 지역 선순환 경제를 확실하게 정착시키기 위해 또 한 번 심청상품권의 변화를 시도한다.우선 현행 1%인 할인율을 5%로 크게 높였다.1~2월 두 달간은 모바일상품권 출시 기념으로 종이형, 모바일 상품권을 각각 10% 할인한다군은 이번 특별할인으로 설 명절 대비 군민들의 가계경제에 도움이 되고, 지역 상가의 매출 증대로 이어질 것으로 보고 있다.도내 최초로 모바일 상품권 발행에도 돌입한다.중소벤처기업부에서 개발한 제로페이와 연계해 은행이나 간편결제사의 앱을 통해 편리하게 상품권을 구매할 수 있다.가맹점은 은행을 방문할 필요 없이 환전이 가능하며, 이용자들은 지역 제로페이 가맹점에서 모바일 심청상품권을 사용할 수 있다.소비자는 연말정산에서 30%의 소득공제 혜택을 받을 수 있고, 결제 수수료가 완전 무료로 소상공인들의 소득세 부담 완화에도 큰 도움이 된다.곡성군은 오는 2월 29일까지 모바일상품권 출시기념 이벤트를 한다.모바일상품권 월 3회 이상 결제한 사람에게 모바일상품권 5천원을 지급한다.모바일상품권을 1번만 결제해도 추첨을 통해 매월 50명에게 곡성 작은 영화관 영화관람권 2매를 제공한다.월 5천원 이상 결제자에 대해서는 추첨을 통해 매월 에어팟, 모바일상품권을 지급할 예정이다.곡성군은 농어민 공익수당을 비롯한 다양한 수당을 상품권으로 지급해 올해 약 75억원의 상품권을 유통할 계획이다.심청상품권 서포터즈를 운영하며 기존 종이 상품권 가맹점의 제로페이 가맹을 독려하고, 신규 가맹점을 확대하고 있다.곡성군 관계자는 14일 ""심청상품권 운영 변화로 지역주민의 상품권 이용률이 높아지고, 최종적으로 지역 상권이 활성화될 것으로 기대하고 있다""고 밝혔다.pch80@yna.co.kr▶확 달라진 연합뉴스 웹을 만나보세요▶네이버 [연합뉴스] 채널 구독▶뭐 하고 놀까? #흥"
20200115,무역갈등 완화에 위안화 랠리…5개월만에 달러당 6.8위안대,https://n.news.naver.com/mnews/article/001/0011333640,"[EPA=연합뉴스 자료사진](베이징=연합뉴스) 김윤구 특파원 = 미중 1단계 무역 합의 서명을 앞두고 중국 위안화 가치 급등세가 이어져 달러당 6.8위안대로 복귀했다.14일 중국 증권일보 등에 따르면 위안화는 류허(劉鶴) 부총리가 대표단을 이끌고 서명을 위해 워싱턴으로 떠난 전날 역내외 시장에서 달러당 6.9위안선을 깨고'6.8시대'로 돌아갔다. 달러당 6.9위안선을 돌파한 것은 지난해 8월 이후 5개월만에 처음이다.위안화는 이날 오전에도 역외시장에서 6.88선을 돌파해 6.8745위안을 찍었다. 위안화 가치는 지난해 7월 26일 이후 가장 높아졌다.증권일보는 1단계 무역 합의 달성에 대한 희망으로 지난달 3일 이후 28 거래일간 달러 대비 위안화 환율이 1천900 베이시스포인트(1bp=0.01%) 가까이 움직였다고 지적했다.무역 갈등 완화와 함께 중국의 경제둔화가 생각만큼 심각하지는 않은 것으로 최근 나타난 것이 위안화 가치 상승 요인으로 꼽힌다.위안화 가치 상승세 속에 미국 재무부는 13일(현지시간) 중국을 환율조작국에서 제외했다. 미 재무부는 보고서에서 위안화 가치가 지난해 9월초 달러당 7.18위안까지 떨어졌다가 10월에 반등했으며 현재 6.93위안 안팎에서 거래되고 있다면서 환율조작국 해제 이유를 설명했다.중국 위안화는 지난해 8월 미중 무역 갈등이 높아졌을 때 10년만에 처음으로 달러당 7위안선을 넘어 약세를 보였었다.위안화가 3개월 안에 달러당 6.8위안에 도달할 것이라는 전망도 나온다고 블룸버그통신은 전했다.싱가포르에 있는 토론토도미니언은행의 선임 신흥시장 전략가 미툴 코체차는 ""통화 강세는 호의를 보여주는 한 방법""이라면서 ""급격하지 않고 점진적인 경제 둔화와 금리의 제한적 하락은 위안화를 떠받칠 것""이라고 말했다.하지만 다른 전문가는 위안화 강세가 일시적일 수 있다며 신중한 견해를 보인다.ykim@yna.co.kr▶확 달라진 연합뉴스 웹을 만나보세요▶네이버 [연합뉴스] 채널 구독▶뭐 하고 놀까? #흥"
20200115,[그래픽] 2019년 하반기 미국 환율보고서 주요국 평가,https://n.news.naver.com/mnews/article/001/0011333228,(서울=연합뉴스) 장성구 기자 = 미국은 13일(현지시간) 중국에 대한 환율조작국 지정을 해제하고 관찰대상국으로 돌려놨다. 한국은 관찰대상국 리스트에 잔류했다.sunggu@yna.co.kr페이스북tuney.kr/LeYN1트위터 @yonhap_graphics▶확 달라진 연합뉴스 웹을 만나보세요▶네이버 [연합뉴스] 채널 구독▶뭐 하고 놀까? #흥
